{
  "schemaVersion": "1.0",
  "id": "builtin-neo-brutalism",
  "name": "Neo Brutalism Yellow",
  "revision": 1,
  "catalogRelease": "0.1.0",
  "compilerVersion": "0.1.0",
  "platform": "react-web",
  "styleFamily": "neo-brutalism",
  "modes": {
    "light": {
      "background": "#FFFFFF",
      "foreground": "#111111",
      "card": "#FFFFFF",
      "cardForeground": "#111111",
      "popover": "#FFFFFF",
      "popoverForeground": "#111111",
      "primary": "#FACC15",
      "primaryForeground": "#111111",
      "secondary": "#F4F4F5",
      "secondaryForeground": "#111111",
      "muted": "#F4F4F5",
      "mutedForeground": "#52525B",
      "accent": "#FEF08A",
      "accentForeground": "#111111",
      "destructive": "#B91C1C",
      "destructiveForeground": "#FFFFFF",
      "border": "#111111",
      "input": "#111111",
      "ring": "#1D4ED8"
    },
    "dark": {
      "background": "#18181B",
      "foreground": "#FAFAFA",
      "card": "#27272A",
      "cardForeground": "#FAFAFA",
      "popover": "#27272A",
      "popoverForeground": "#FAFAFA",
      "primary": "#FACC15",
      "primaryForeground": "#111111",
      "secondary": "#3F3F46",
      "secondaryForeground": "#FAFAFA",
      "muted": "#27272A",
      "mutedForeground": "#A1A1AA",
      "accent": "#FEF08A",
      "accentForeground": "#111111",
      "destructive": "#FCA5A5",
      "destructiveForeground": "#111111",
      "border": "#FAFAFA",
      "input": "#FAFAFA",
      "ring": "#93C5FD"
    }
  },
  "design": {
    "fontFamilyId": "system-sans",
    "radiusRem": 0,
    "density": "comfortable",
    "borderWidthPx": 2,
    "shadowOffsetXPx": 4,
    "shadowOffsetYPx": 4,
    "motion": "reduced",
    "transparency": "reduced"
  },
  "componentDefaults": {
    "button": {
      "variant": "default",
      "size": "default"
    }
  }
}
